{
  "$schema": "./publication-manifest.schema.json",
  "schemaVersion": 1,
  "locale": "it",
  "market": "IT",
  "baselineReviewId": "review:baseline-main-a952269",
  "releaseIntegrityApprovalId": "review:2026-09-19-case-visual-integrity",
  "staticArtifacts": {
    "/": "sha256:62f0da96880ae1fe3d4a9411d9719c8da1c0eca9d41e53aa865187f2601cb45e",
    "/it/calcolatori/": "sha256:8e31b7968bcf58da8f01259a55a02d5e1a2ac57629fe2d4a435f92110a6304a5",
    "/it/guide/": "sha256:37058b47feca9eadb9a001180c1097cb49395ac4326834f310a9890e88e6b912",
    "/privacy.html": "sha256:8da2371df697599494a8885b5aad58d4285f8d9468dddb50cfd2611106be2325",
    "/terms.html": "sha256:d39d12e63b2b852b41e4752fde1deae588658611e5547811ca055f9b0f1f2050"
  },
  "records": [
    {
      "contentId": "guide/calcolo-costo-trasporto",
      "canonical": "/it/guide/calcolo-costo-trasporto/",
      "audienceMarket": "IT",
      "changeScope": "substantive-update",
      "intentOwner": "calcolo costo trasporto",
      "demandEvidenceId": "demand:recovery-calcolo-costo-trasporto-20260905",
      "approvalId": "review:2026-09-05-calcolo-costo-trasporto",
      "productProofIds": [
        "complete-route-calculation"
      ],
      "primarySourceUrls": [
        "https://www.mit.gov.it/documentazione/valori-indicativi-di-riferimento-dei-costi-di-esercizio-dellimpresa-italiana-di-6"
      ]
    },
    {
      "contentId": "guide/costi-autotrasporto",
      "canonical": "/it/guide/costi-autotrasporto/",
      "audienceMarket": "IT",
      "changeScope": "substantive-update",
      "intentOwner": "costi autotrasporto",
      "demandEvidenceId": "demand:maintenance-costi-autotrasporto",
      "approvalId": "review:2026-09-03-costi-autotrasporto",
      "productProofIds": [
        "cost-breakdown"
      ],
      "primarySourceUrls": [
        "https://www.mit.gov.it/documentazione/valori-indicativi-di-riferimento-dei-costi-di-esercizio-dellimpresa-italiana-di-6"
      ]
    },
    {
      "contentId": "guide/costo-furgone-per-km",
      "canonical": "/it/guide/costo-furgone-per-km/",
      "audienceMarket": "IT",
      "changeScope": "metadata-or-links",
      "intentOwner": "costo furgone per km",
      "demandEvidenceId": "demand:maintenance-costo-furgone-per-km",
      "approvalId": "review:2026-09-06-costo-furgone-per-km",
      "productProofIds": [
        "cost-breakdown"
      ],
      "primarySourceUrls": []
    },
    {
      "contentId": "guide/costo-orario-autista-camion",
      "canonical": "/it/guide/costo-orario-autista-camion/",
      "audienceMarket": "IT",
      "changeScope": "substantive-update",
      "intentOwner": "costo orario autista camion",
      "demandEvidenceId": "demand:recovery-costo-orario-autista-camion",
      "approvalId": "review:2026-08-28-costo-orario-autista-camion",
      "productProofIds": [
        "cost-breakdown"
      ],
      "primarySourceUrls": [
        "https://www.lavoro.gov.it/temi-e-priorita/rapporti-di-lavoro-e-relazioni-industriali/focus/settore-della-logistica-trasporto-merci-spedizione"
      ]
    },
    {
      "contentId": "guide/preventivo-trasporto-pdf",
      "canonical": "/it/guide/preventivo-trasporto-pdf/",
      "audienceMarket": "IT",
      "changeScope": "substantive-update",
      "intentOwner": "preventivo trasporto PDF",
      "demandEvidenceId": "demand:bofu-pdf-20260907",
      "approvalId": "review:2026-09-19-case-pdf",
      "productProofIds": [
        "pdf-quote"
      ],
      "primarySourceUrls": [
        "https://apps.apple.com/it/app/routebudget/id6789717191"
      ]
    },
    {
      "contentId": "guide/proteggere-margine-tratta",
      "canonical": "/it/guide/proteggere-margine-tratta/",
      "audienceMarket": "IT",
      "changeScope": "substantive-update",
      "intentOwner": "analisi sensibilità margine tratta",
      "demandEvidenceId": "demand:recovery-proteggere-margine-20260831",
      "approvalId": "review:2026-08-31-proteggere-margine-tratta",
      "productProofIds": [
        "cost-scenarios"
      ],
      "primarySourceUrls": [
        "https://www.mit.gov.it/documentazione/valori-indicativi-di-riferimento-dei-costi-di-esercizio-dellimpresa-italiana-di-6",
        "https://sisen.mase.gov.it/dgsaie/prezzi-mensili-carburanti"
      ]
    },
    {
      "contentId": "guide/quanto-consuma-un-camion",
      "canonical": "/it/guide/quanto-consuma-un-camion/",
      "audienceMarket": "IT",
      "changeScope": "substantive-update",
      "intentOwner": "quanto consuma un camion",
      "demandEvidenceId": "demand:bofu-consumo-20260907",
      "approvalId": "review:2026-09-07-bofu-consumo",
      "productProofIds": [
        "fuel-estimate"
      ],
      "primarySourceUrls": [
        "https://apps.apple.com/it/app/routebudget/id6789717191"
      ]
    },
    {
      "contentId": "guide/quanto-consuma-un-furgone",
      "canonical": "/it/guide/quanto-consuma-un-furgone/",
      "audienceMarket": "IT",
      "changeScope": "metadata-or-links",
      "intentOwner": "quanto consuma un furgone",
      "demandEvidenceId": "demand:maintenance-quanto-consuma-furgone",
      "approvalId": "review:2026-08-23-quanto-consuma-un-furgone",
      "productProofIds": [
        "fuel-estimate"
      ],
      "primarySourceUrls": []
    },
    {
      "contentId": "guide/tempi-attesa-carico-scarico-autotrasporto",
      "canonical": "/it/guide/tempi-attesa-carico-scarico-autotrasporto/",
      "audienceMarket": "IT",
      "changeScope": "substantive-update",
      "intentOwner": "indennizzo tempi di attesa carico scarico autotrasporto",
      "demandEvidenceId": "demand:maintenance-tempi-attesa",
      "approvalId": "review:2026-08-28-tempi-attesa",
      "productProofIds": [
        "pdf-quote"
      ],
      "primarySourceUrls": [
        "https://www.mit.gov.it/comunicazione/news/autotrasporto-misure-significative-nel-decreto-infrastrutture",
        "https://www.gazzettaufficiale.it/atto/serie_generale/caricaArticolo?art.codiceRedazionale=25A04106&art.dataPubblicazioneGazzetta=2025-07-19&art.flagTipoArticolo=0&art.idArticolo=4&art.idGruppo=2&art.idSottoArticolo=1&art.idSottoArticolo1=10&art.progressivo=0&art.versione=1"
      ]
    },
    {
      "contentId": "guide/tempi-guida-riposo-camion",
      "canonical": "/it/guide/tempi-guida-riposo-camion/",
      "audienceMarket": "IT",
      "changeScope": "substantive-update",
      "intentOwner": "calcolo tempi di guida e riposo camion",
      "demandEvidenceId": "demand:maintenance-tempi-guida-riposo",
      "approvalId": "review:2026-09-06-tempi-guida-riposo-camion",
      "productProofIds": [
        "complete-route-calculation"
      ],
      "primarySourceUrls": [
        "https://eur-lex.europa.eu/legal-content/IT/TXT/?uri=CELEX:02006R0561-20241231",
        "https://transport.ec.europa.eu/transport-modes/road/tachograph_en?prefLang=it"
      ]
    },
    {
      "contentId": "calcolatori/costo-carburante-viaggio",
      "canonical": "/it/calcolatori/costo-carburante-viaggio/",
      "audienceMarket": "IT",
      "changeScope": "substantive-update",
      "intentOwner": "calcolatore costo carburante viaggio",
      "demandEvidenceId": "demand:bofu-carburante-20260907",
      "approvalId": "review:2026-09-19-case-carburante",
      "productProofIds": [
        "fuel-estimate"
      ],
      "primarySourceUrls": [
        "https://apps.apple.com/it/app/routebudget/id6789717191"
      ]
    },
    {
      "contentId": "calcolatori/costo-chilometrico-camion",
      "canonical": "/it/calcolatori/costo-chilometrico-camion/",
      "audienceMarket": "IT",
      "changeScope": "substantive-update",
      "intentOwner": "costo km camion",
      "demandEvidenceId": "demand:bofu-chilometrico-20260907",
      "approvalId": "review:2026-09-19-case-chilometrico",
      "productProofIds": [
        "cost-breakdown"
      ],
      "primarySourceUrls": [
        "https://apps.apple.com/it/app/routebudget/id6789717191"
      ]
    },
    {
      "contentId": "calcolatori/quanto-costa-ricaricare-furgone-elettrico",
      "canonical": "/it/calcolatori/quanto-costa-ricaricare-furgone-elettrico/",
      "audienceMarket": "IT",
      "changeScope": "new-content",
      "intentOwner": "quanto costa ricaricare un furgone elettrico",
      "demandEvidenceId": "demand:round-12-ricarica-furgone-elettrico",
      "approvalId": "review:2026-08-23-ricarica-furgone-elettrico",
      "productProofIds": [
        "fuel-estimate"
      ],
      "primarySourceUrls": [
        "https://www.fiat.it/professional/modello/ducato-elettrico/ricarica-rapida",
        "https://eur-lex.europa.eu/eli/reg/2023/1804/oj?locale=it",
        "https://www.arera.it/fileadmin/allegati/faq/faq_veicoli_ele.pdf"
      ]
    },
    {
      "contentId": "calcolatori/prezzo-minimo-margine-tratta",
      "canonical": "/it/calcolatori/prezzo-minimo-margine-tratta/",
      "audienceMarket": "IT",
      "changeScope": "new-content",
      "intentOwner": "come calcolare il prezzo di un trasporto",
      "demandEvidenceId": "demand:round-12-margine-trasporto",
      "approvalId": "review:2026-08-23-margine-trasporto",
      "productProofIds": [
        "cost-scenarios"
      ],
      "primarySourceUrls": [
        "https://www.mit.gov.it/documentazione/valori-indicativi-di-riferimento-dei-costi-di-esercizio-dellimpresa-italiana-di-6",
        "https://www.mit.gov.it/nfsmitgov/files/media/documentazione/2026-03/Legenda.pdf"
      ]
    },
    {
      "contentId": "calcolatori/tempi-guida-camion",
      "canonical": "/it/calcolatori/tempi-guida-camion/",
      "audienceMarket": "IT",
      "changeScope": "new-content",
      "intentOwner": "calcolatore dei tempi di guida",
      "demandEvidenceId": "demand:round-12-tempi-guida-camion",
      "approvalId": "review:2026-08-23-tempi-guida-camion",
      "productProofIds": [
        "complete-route-calculation"
      ],
      "primarySourceUrls": [
        "https://eur-lex.europa.eu/legal-content/IT/TXT/?uri=CELEX%3A02006R0561-20241231",